{"$schema":"https://json-schema.org/draft/2020-12/schema","$id":"urn:gew:schema:profile-semantic-policy:1.0.0","$defs":{"id":{"type":"string","minLength":1,"maxLength":255},"ids":{"type":"array","minItems":1,"maxItems":16384,"uniqueItems":true,"items":{"$ref":"#/$defs/id"}},"minima":{"type":"object","properties":{"required_node_ids":{"$ref":"#/$defs/ids"},"validator_ids":{"$ref":"#/$defs/ids"},"completion_predicate_ids":{"$ref":"#/$defs/ids"},"rollback_verification_ids":{"$ref":"#/$defs/ids"},"target_verification_ids":{"$ref":"#/$defs/ids"},"required_edge_ids":{"$ref":"#/$defs/ids"},"artifact_contract_ids":{"$ref":"#/$defs/ids"},"required_capability_ids":{"$ref":"#/$defs/ids"}},"required":["required_node_ids","validator_ids","completion_predicate_ids","rollback_verification_ids","target_verification_ids","required_edge_ids","artifact_contract_ids","required_capability_ids"],"additionalProperties":false},"profile":{"type":"object","properties":{"profile_id":{"$ref":"#/$defs/id"},"profile_version":{"$ref":"#/$defs/id"},"approved_body_digest":{"$ref":"#/$defs/id"},"approved_definition_body_digest":{"$ref":"#/$defs/id"},"semantic_minima":{"$ref":"#/$defs/minima"}},"required":["profile_id","profile_version","approved_body_digest","approved_definition_body_digest","semantic_minima"],"additionalProperties":false},"budgetLimit":{"type":"object","properties":{"budget_id":{"$ref":"#/$defs/id"},"maximum":{"type":"integer","minimum":1}},"required":["budget_id","maximum"],"additionalProperties":false},"projectTighteningPolicy":{"type":"object","properties":{"schema_version":{"const":"1.0.0"},"policy_id":{"$ref":"#/$defs/id"},"base_budget_limits":{"type":"array","minItems":1,"maxItems":1024,"items":{"$ref":"#/$defs/budgetLimit"}},"policy_digest":{"$ref":"#/$defs/id"},"loop_budget_registry_id":{"$ref":"#/$defs/id"},"loop_budget_registry_digest":{"$ref":"#/$defs/id"}},"required":["schema_version","policy_id","loop_budget_registry_id","loop_budget_registry_digest","base_budget_limits","policy_digest"],"additionalProperties":false},"idsEmpty":{"type":"array","maxItems":16384,"uniqueItems":true,"items":{"$ref":"#/$defs/id"}},"baseSets":{"type":"object","properties":{"required_node_ids":{"$ref":"#/$defs/ids"},"required_edge_ids":{"$ref":"#/$defs/idsEmpty"},"artifact_contract_ids":{"$ref":"#/$defs/ids"},"validator_ids":{"$ref":"#/$defs/idsEmpty"},"completion_predicate_ids":{"$ref":"#/$defs/ids"},"required_invariant_ids":{"$ref":"#/$defs/ids"}},"required":["required_node_ids","required_edge_ids","artifact_contract_ids","validator_ids","completion_predicate_ids","required_invariant_ids"],"unevaluatedProperties":false},"riskMinimum":{"type":"object","properties":{"overlay_id":{"$ref":"#/$defs/id"},"node_additions":{"$ref":"#/$defs/idsEmpty"},"edge_additions":{"$ref":"#/$defs/idsEmpty"},"entry_condition_ids":{"$ref":"#/$defs/ids"},"exit_condition_ids":{"$ref":"#/$defs/ids"},"required_invariant_ids":{"$ref":"#/$defs/ids"},"budget_limits":{"type":"array","minItems":1,"maxItems":1024,"items":{"$ref":"#/$defs/budgetLimit"}}},"required":["overlay_id","node_additions","edge_additions","entry_condition_ids","exit_condition_ids","required_invariant_ids","budget_limits"],"unevaluatedProperties":false}},"type":"object","properties":{"schema_version":{"const":"1.0.0"},"policy_id":{"$ref":"#/$defs/id"},"approved_profile_registry_digest":{"$ref":"#/$defs/id"},"coverage_policy_digest":{"$ref":"#/$defs/id"},"core_invariant_ids":{"$ref":"#/$defs/ids"},"profiles":{"type":"array","minItems":1,"maxItems":64,"items":{"$ref":"#/$defs/profile"}},"project_tightening_policy":{"$ref":"#/$defs/projectTighteningPolicy"},"policy_digest":{"$ref":"#/$defs/id"},"base_semantic_sets":{"$ref":"#/$defs/baseSets"},"risk_path_minima":{"type":"array","minItems":1,"maxItems":16,"items":{"$ref":"#/$defs/riskMinimum"}}},"required":["schema_version","policy_id","approved_profile_registry_digest","coverage_policy_digest","core_invariant_ids","base_semantic_sets","profiles","risk_path_minima","project_tightening_policy","policy_digest"],"unevaluatedProperties":false}
