{"schema_version":"1.0.0","policy_id":"urn:gew:profile-semantic-policy:v1","approved_profile_registry_digest":"sha256-jcs-v1:694655c82293cbf25b41dca7a1c87e3d37989eb11058375ed1c778786b268fdc","coverage_policy_digest":"sha256-jcs-v1:946c6f6875ef74e944be328de0ecb0a936f44ef937bd5d556ae5450610f8f488","core_invariant_ids":["authority","completion","digest","finite-budget","independent-review","invalidation","replay-protection","schema"],"profiles":[{"profile_id":"new-feature","profile_version":"1.0.0","approved_body_digest":"sha256-jcs-v1:c4a4b73c3659743ab135d5a22c7d66ad0eb8fd9897ad579a2d1ac0a3d83c8bad","approved_definition_body_digest":"sha256-jcs-v1:315866a83da782e00bb38e3c191131845644fb1167465de64e373aeaac854bab","semantic_minima":{"required_node_ids":["implementation","project-discovery","regression-verification","target-acceptance"],"required_edge_ids":["candidate-review-to-completion-gate","implementation-to-regression-verification","project-discovery-to-target-acceptance","regression-verification-to-candidate-review","target-acceptance-to-implementation","target-verification-to-completion-gate"],"validator_ids":["new-feature-acceptance","new-feature-regression","new-feature-target-realization"],"completion_predicate_ids":["target-state-matched"],"rollback_verification_ids":["restored-target-state"],"target_verification_ids":["new-feature-target-realization","target-state-matched","target-verification"],"required_capability_ids":["project-read","target-observe"],"artifact_contract_ids":["urn:gew:artifact-contract:candidate-review:1.0.0","urn:gew:artifact-contract:completion-record:1.0.0","urn:gew:artifact-contract:impact:1.0.0","urn:gew:artifact-contract:implementation:1.0.0","urn:gew:artifact-contract:plan:1.0.0","urn:gew:artifact-contract:prd:1.0.0","urn:gew:artifact-contract:tech-spec:1.0.0","urn:gew:artifact-contract:test-plan:1.0.0","urn:gew:artifact-contract:verification:1.0.0"]}},{"profile_id":"bug-fix","profile_version":"1.0.0","approved_body_digest":"sha256-jcs-v1:fddfd3aec2c7afebfc2aaca85d387eac2059e314835c08b5cfae00ff8232baf6","approved_definition_body_digest":"sha256-jcs-v1:3bf7d44f74749c33d95aaf9d3fe0e24a639f2b070085e92ae8eb5bb3485fda81","semantic_minima":{"required_node_ids":["regression-guard","reproduction","root-cause-boundary"],"required_edge_ids":["bug-fix-category-to-completion"],"validator_ids":["bug-fix-regression","bug-fix-reproduction"],"completion_predicate_ids":["regression-guard-passed","root-cause-bounded"],"rollback_verification_ids":["restored-target-state"],"target_verification_ids":["bug-fix-regression","regression-guard","regression-guard-passed"],"required_capability_ids":["project-read","target-observe"],"artifact_contract_ids":["urn:gew:artifact-contract:candidate-review:1.0.0","urn:gew:artifact-contract:completion-record:1.0.0","urn:gew:artifact-contract:impact:1.0.0","urn:gew:artifact-contract:implementation:1.0.0","urn:gew:artifact-contract:plan:1.0.0","urn:gew:artifact-contract:prd:1.0.0","urn:gew:artifact-contract:tech-spec:1.0.0","urn:gew:artifact-contract:test-plan:1.0.0","urn:gew:artifact-contract:verification:1.0.0"]}},{"profile_id":"hotfix","profile_version":"1.0.0","approved_body_digest":"sha256-jcs-v1:06e4d84cbe58af0220a896f057f54f1cf58bbb2e28d8775260ea4ed47a5bfec1","approved_definition_body_digest":"sha256-jcs-v1:6d8c699f2274647ae651bed5f99f6922cf0894412909107b5d1393e4e01d392c","semantic_minima":{"required_node_ids":["containment","minimal-change","production-verification","rollback-readiness"],"required_edge_ids":["hotfix-category-to-completion"],"validator_ids":["hotfix-impact","hotfix-production"],"completion_predicate_ids":["production-state-verified","rollback-ready"],"rollback_verification_ids":["rollback-readiness-verified"],"target_verification_ids":["hotfix-production","production-state-verified","production-verification"],"required_capability_ids":["project-read","target-observe"],"artifact_contract_ids":["urn:gew:artifact-contract:candidate-review:1.0.0","urn:gew:artifact-contract:completion-record:1.0.0","urn:gew:artifact-contract:impact:1.0.0","urn:gew:artifact-contract:implementation:1.0.0","urn:gew:artifact-contract:plan:1.0.0","urn:gew:artifact-contract:prd:1.0.0","urn:gew:artifact-contract:tech-spec:1.0.0","urn:gew:artifact-contract:test-plan:1.0.0","urn:gew:artifact-contract:verification:1.0.0"]}},{"profile_id":"refactor-debt","profile_version":"1.0.0","approved_body_digest":"sha256-jcs-v1:51d486a19a8794f74a01b158c40fb338fd95d557995797988f45b09ec1c4971e","approved_definition_body_digest":"sha256-jcs-v1:88679c01f4f4cc452d954497c78097f7a83c3d90e3b0dff7942a256085c9635c","semantic_minima":{"required_node_ids":["behavior-baseline","behavior-preservation","quality-proof"],"required_edge_ids":["refactor-debt-category-to-completion"],"validator_ids":["refactor-behavior","refactor-quality"],"completion_predicate_ids":["behavior-preserved","debt-target-proved"],"rollback_verification_ids":["restored-behavior-baseline"],"target_verification_ids":["behavior-preservation","behavior-preserved","refactor-behavior"],"required_capability_ids":["project-read","target-observe"],"artifact_contract_ids":["urn:gew:artifact-contract:candidate-review:1.0.0","urn:gew:artifact-contract:completion-record:1.0.0","urn:gew:artifact-contract:impact:1.0.0","urn:gew:artifact-contract:implementation:1.0.0","urn:gew:artifact-contract:plan:1.0.0","urn:gew:artifact-contract:prd:1.0.0","urn:gew:artifact-contract:tech-spec:1.0.0","urn:gew:artifact-contract:test-plan:1.0.0","urn:gew:artifact-contract:verification:1.0.0"]}},{"profile_id":"migration","profile_version":"1.0.0","approved_body_digest":"sha256-jcs-v1:e233a9fdbf9daadb9bb678d7ac2f707cf719cc5d23096ec69054dd04338289c8","approved_definition_body_digest":"sha256-jcs-v1:a20cb2e9affacb5510780544b5f8718a9596952d511bea64a62cc29ded758711","semantic_minima":{"required_node_ids":["compatibility-matrix","data-integrity","migration-sequencing","rollback-rehearsal"],"required_edge_ids":["migration-category-to-completion"],"validator_ids":["migration-compatibility","migration-data-integrity"],"completion_predicate_ids":["forward-path-verified","rollback-path-verified"],"rollback_verification_ids":["rollback-rehearsal-passed"],"target_verification_ids":["data-integrity","forward-path-verified","migration-data-integrity"],"required_capability_ids":["project-read","target-observe"],"artifact_contract_ids":["urn:gew:artifact-contract:candidate-review:1.0.0","urn:gew:artifact-contract:completion-record:1.0.0","urn:gew:artifact-contract:impact:1.0.0","urn:gew:artifact-contract:implementation:1.0.0","urn:gew:artifact-contract:plan:1.0.0","urn:gew:artifact-contract:prd:1.0.0","urn:gew:artifact-contract:tech-spec:1.0.0","urn:gew:artifact-contract:test-plan:1.0.0","urn:gew:artifact-contract:verification:1.0.0"]}},{"profile_id":"dependency-security","profile_version":"1.0.0","approved_body_digest":"sha256-jcs-v1:f8306ab5eae99d16eb6698ffbd987d9e79a548f3db7262c6449855f22a2dcd56","approved_definition_body_digest":"sha256-jcs-v1:3c48166e88ace0c4697f21a76da13b1ec9f3093f96bfdbabf1ae366dbf2b3416","semantic_minima":{"required_node_ids":["applicability-exposure","security-regression","upgrade-fix"],"required_edge_ids":["dependency-security-category-to-completion"],"validator_ids":["dependency-exposure","dependency-security-regression"],"completion_predicate_ids":["fix-verified","residual-exposure-recorded"],"rollback_verification_ids":["dependency-state-restored"],"target_verification_ids":["dependency-security-regression","fix-verified","security-regression"],"required_capability_ids":["project-read","target-observe"],"artifact_contract_ids":["urn:gew:artifact-contract:candidate-review:1.0.0","urn:gew:artifact-contract:completion-record:1.0.0","urn:gew:artifact-contract:impact:1.0.0","urn:gew:artifact-contract:implementation:1.0.0","urn:gew:artifact-contract:plan:1.0.0","urn:gew:artifact-contract:prd:1.0.0","urn:gew:artifact-contract:tech-spec:1.0.0","urn:gew:artifact-contract:test-plan:1.0.0","urn:gew:artifact-contract:verification:1.0.0"]}},{"profile_id":"performance","profile_version":"1.0.0","approved_body_digest":"sha256-jcs-v1:459752fc63e74928def489be2a9d9c6a17986de73f50fc5361cfceb561ca9f7c","approved_definition_body_digest":"sha256-jcs-v1:62b6c44f3782e27eb71c9f9895ad4347594c245b7a0aa97d31b5d22da0fc1aaa","semantic_minima":{"required_node_ids":["comparable-measurement","correctness-regression","repeatable-baseline"],"required_edge_ids":["performance-category-to-completion"],"validator_ids":["performance-correctness","performance-measurement"],"completion_predicate_ids":["performance-target-proved","regressions-excluded"],"rollback_verification_ids":["performance-baseline-restored"],"target_verification_ids":["comparable-measurement","performance-measurement","performance-target-proved"],"required_capability_ids":["project-read","target-observe"],"artifact_contract_ids":["urn:gew:artifact-contract:candidate-review:1.0.0","urn:gew:artifact-contract:completion-record:1.0.0","urn:gew:artifact-contract:impact:1.0.0","urn:gew:artifact-contract:implementation:1.0.0","urn:gew:artifact-contract:plan:1.0.0","urn:gew:artifact-contract:prd:1.0.0","urn:gew:artifact-contract:tech-spec:1.0.0","urn:gew:artifact-contract:test-plan:1.0.0","urn:gew:artifact-contract:verification:1.0.0"]}},{"profile_id":"release-operations","profile_version":"1.0.0","approved_body_digest":"sha256-jcs-v1:2ef7f38a78fa5556298d3a1d359abfabfcaac094fd62280bcb99fc421e9cfc0b","approved_definition_body_digest":"sha256-jcs-v1:777b207547ee37585134067f0d16b7c037401382b26426a310173507e63938df","semantic_minima":{"required_node_ids":["artifact-provenance","environment-action","health-verification","rollback-readiness"],"required_edge_ids":["release-operations-category-to-completion"],"validator_ids":["release-health","release-provenance"],"completion_predicate_ids":["release-health-passed","rollback-ready"],"rollback_verification_ids":["rollback-readiness-verified"],"target_verification_ids":["health-v